,group_name,city,country,ratings,created_date,members,last_event,next_event,category,primary_topic,membership_fees,last_event_rsvp,next_event_rsvp
1892,Compassion Technology: Mindful QS,Redwood City,US,0,1331284252000,119,,,tech,,0,,
1893,Tai Chi with Cheery Living,Castro Valley,US,4.99,1331314376000,58,,,health/wellbeing,,0,,
1894,North Bay Hiking Group,Mill Valley,US,4.89,1331323350000,794,,,outdoors/adventure,,0,,
1895,"A Course in Weight Loss Book Study, Coaching & Support Group",Walnut Creek,US,4.67,1331338959000,31,,,health/wellbeing,,0,,
1896,San Ramon Valley Vegan Voices,Walnut Creek,US,4.85,1331347117000,36,,,food/drink,,0,,
1897,Freemium San Francisco Bay Area,San Francisco,US,4.62,1331411055000,723,,,career/business,,0,,
1898,"Dolphins, Whales & Podmates Meetup Group",Oakland,US,5,1331428091000,43,,,health/wellbeing,,0,,
1899,Volunteer Oakland,Oakland,US,4.4,1331434171000,357,,,community/environment,,0,,
1900,VetsInTech/Startup Veterans,San Francisco,US,4.78,1331490177000,208,,,career/business,,0,,
1901,What the Dickens? THE BAY AREA PICKWICK CLUB,Concord,US,4.98,1331506123000,26,,,book clubs,,0,,
1902,"Beautiful Singles in 20's, 30's, and 40's",San Francisco,US,4.95,1331612842000,3142,,,socializing,,0,,
1903,Mt. Diablo Business Women,Lafayette,US,4.95,1331699390000,324,,,career/business,,0,,
1904,Small Business and Entrepreneurs,San Leandro,US,4.3,1331730474000,100,,,career/business,,0,,
1905,WordPress Open Studio,San Francisco,US,4.27,1331747624000,441,,,tech,,0,,
1906,Tech in Motion Events: San Francisco,San Francisco,US,4.51,1331823029000,7529,,,tech,,0,,
1907,The Oakland Italian Language Meet Up,Oakland,US,4.68,1331838772000,295,,,language/ethnic identity,,0,,
1908,The Foreclosure Investor Tour,Belmont,US,4.4,1331843512000,728,,,career/business,,0,,
1909,The Berkeley Modern Shamanism Meetup Group,Berkeley,US,4,1332034582000,46,,,new age/spirituality,,0,,
1910,The Design Business,San Francisco,US,4.87,1332039369000,333,,,career/business,,0,,
1911,Golden Gate Computer Society,San Rafael,US,4.52,1332199785000,165,,,tech,,0,,
1912,Parse SF Bay Area,Menlo Park,US,4.4,1332200403000,473,,,tech,,0,,
1913,East Bay Access/SQL Server Database Users Group,Oakland,US,4.1,1332226339000,142,,,tech,,0,,
1914,~ East Bay Over 40 Singles ~,Walnut Creek,US,4.54,1332382163000,2716,,,singles,,0,,
1915,SF Datomic & Datascript,San Francisco,US,4.38,1332393527000,211,,,tech,,0,,
1916,Funtography Club,Fremont,US,4.69,1332480090000,559,,,photography,,0,,
1917,Mobile Games SF,San Francisco,US,4.53,1332503690000,480,,,tech,,0,,
1918,Belmont Lions,Belmont,US,4.88,1332544951000,11,,,community/environment,,0,,
1919,How About A Date? San Francisco,San Francisco,US,4.45,1332607021000,7320,,,singles,,0,,
1920,Psychology Book Club,Palo Alto,US,4.76,1332724509000,406,,,book clubs,,0,,
1921,KIZOMBA SF,Emeryville,US,0,1332733275000,123,,,dancing,,0,,
1922,San Francisco Young Prof'ls -Business & Social Networking,San Francisco,US,4.67,1332786445000,1968,,,career/business,,0,,
1923,San Francisco Bay Area Robotics Group,San Francisco,US,4.6,1332796878000,1233,,,tech,,0,,
1924,Bay Area Social Wine Tasting Meetup Group,San Francisco,US,4.12,1332806664000,976,,,socializing,,0,,
1925,IoTBayArea,Berkeley,US,5,1332808269000,206,,,tech,,0,,
1926,Let's Network and Find Jobs!,San Francisco,US,4.79,1332973904000,577,,,career/business,,0,,
1927,The San Francisco Project Reboot Group,San Francisco,US,5,1333044203000,126,,,movies/film,,0,,
1928,San Francisco Metrics Meetup,San Francisco,US,4.65,1333059368000,1174,,,tech,,0,,
1929,Bay Area Private Money Lenders Group,Fremont,US,4.74,1333122451000,1435,,,career/business,,0,,
1930,"Evolving Consciousness, & Manifestors",Oakland,US,5,1333325077000,22,,,new age/spirituality,,0,,
1931,SPACE GEEKS FTW.,San Francisco,US,4.23,1333387942000,372,,,sci-fi/fantasy,,0,,
1932,Apache Shiro Users Group,San Mateo,US,4.92,1333389423000,54,,,tech,,0,,
1933,Berkeley Startup: Idea to IPO,Berkeley,US,4.24,1333438055000,1987,,,career/business,,0,,
1934,Dancing with your Soul after a Divorce/Separation,Lafayette,US,4.94,1333497634000,218,,,support,,0,,
1935,North Bay Mobile App Developers,San Rafael,US,4.97,1333503807000,279,,,tech,,0,,
1936,PyLadies of San Francisco,San Francisco,US,4.79,1333518348000,2800,,,tech,,0,,
1937,Fun Soccer Saturdays,San Francisco,US,4.78,1333518477000,3321,,,sports/recreation,,0,,
1938,San Francisco Tech Trivia,San Francisco,US,4.85,1333575268000,100,,,tech,,0,,
1939,Technology for Real Estate Professionals,San Francisco,US,4.68,1333657798000,455,,,career/business,,0,,
1940,Startup Cofounders,Palo Alto,US,4.49,1333751549000,1288,,,tech,,0,,
1941,Startup Grind North Bay,San Rafael,US,4.8,1333752671000,417,,,tech,,0,,
1942,UpOut San Francisco - Awesome Events,San Francisco,US,4.5,1333752685000,770,,,socializing,,0,,
1943,Diablo Valley Photography,Walnut Creek,US,4.74,1333994562000,297,,,photography,,0,,
1944,"""Cooking For A Crowd"" in San Francisco",San Francisco,US,4.89,1334109717000,165,,,socializing,,0,,
1945,Centro Americanos de San Francisco,San Francisco,US,5,1334166206000,135,,,language/ethnic identity,,0,,
1946,Let's go Hiking and make new friends [SF],San Francisco,US,4.92,1334189474000,881,,,outdoors/adventure,,0,,
1947,San Francisco IaaS Cloud Developers,San Francisco,US,5,1334254931000,40,,,tech,,0,,
1948,Bay Area Anything Active,Berkeley,US,4.89,1334432640000,5438,,,outdoors/adventure,,0,,
1949,The San Francisco Girly Book Club,San Francisco,US,4.59,1334512886000,747,,,book clubs,,0,,
1950,Interaction Design Studio,San Francisco,US,4.3,1334518682000,1178,,,tech,,0,,
1951,You Know You Are a Travel Girl  When...,Moraga,US,0,1334520024000,170,,,socializing,,0,,
1952,Demand Generation Marketers,San Francisco,US,5,1334536740000,218,,,career/business,,0,,
1953,San Francisco Giants Nation!!!,San Francisco,US,4.33,1334595766000,223,,,socializing,,0,,
1954,"San Fran Yoga, Hiking & Meditation Meetup Group",San Francisco,US,4.69,1334615522000,1018,,,health/wellbeing,,0,,
1955,Peninsula Francophonia,San Mateo,US,4.86,1334634880000,284,,,language/ethnic identity,,0,,
1956,Left Coast Theatre Co. Playwriting Workshop,San Francisco,US,4.88,1334635388000,115,,,fine arts/culture,,0,,
1957,"Mobile Payments and Monetization - iOS, Android & HTML5",San Francisco,US,3,1334670420000,197,,,tech,,0,,
1958,Marin Photo Club Meetup,San Rafael,US,4.71,1334706836000,530,,,photography,,0,,
1959,Liberty Alliance of San Mateo County,San Mateo,US,4.83,1334730042000,29,,,movements/politics,,0,,
1960,East Bay singles over 50,Berkeley,US,4.21,1334861594000,567,,,singles,,0,,
1961,Bay Area Stream Processing,Emeryville,US,4.33,1334908627000,888,,,tech,,0,,
1962,Fund Your Startup SF,San Francisco,US,4.59,1334968269000,761,,,career/business,,0,,
1963,Privacy Innovation & Technology,San Francisco,US,4.87,1334968475000,396,,,tech,,0,,
1964,New York City By The Bay,San Francisco,US,4.65,1335106369000,625,,,socializing,,0,,
1965,Singleaires Hiking Activity Group,Palo Alto,US,4.78,1335212126000,645,,,outdoors/adventure,,0,,
1966,The San Francisco iOS Developers' Meetup,San Francisco,US,4.08,1335311500000,753,,,tech,,0,,
1967,Women transitioning in their 30s,Palo Alto,US,4.89,1335416765000,437,,,health/wellbeing,,0,,
1968,San Francisco Bay Area Big Data and Scalable Systems,San Francisco,US,4.5,1335447976000,1703,,,tech,,0,,
1969,East Bay JavaScript Meetup Group,Oakland,US,4.65,1335487199000,2010,,,tech,,0,,
1970,Bay Area Native Americans,San Francisco,US,5,1335561865000,218,,,language/ethnic identity,,0,,
1971,SF Bay Area Zazzle Designer Meetup,Berkeley,US,0,1335565836000,6,,,fine arts/culture,,0,,
1972,San Francisco Bay Area Jaspersoft User Group,San Francisco,US,5,1335669098000,80,,,tech,,0,,
1973,Arduino Bay - San Francisco Bay Area Arduino User Group,San Francisco,US,4.72,1335730453000,871,,,tech,,0,,
1974,Walnut Creek Laid-back Ladies (25-35),Walnut Creek,US,4.9,1335742699000,326,,,socializing,,0,,
1975,San Carlos Chamber of Commerce,San Carlos,US,4.7,1335821730000,333,,,career/business,,0,,
1976,Slow Food Bay Area,Berkeley,US,4.75,1335894912000,296,,,food/drink,,0,,
1977,Online Payments - South Bay Fintech,Palo Alto,US,4.83,1335896762000,490,,,career/business,,0,,
1978,Raspberry Pi (and More!) San Francisco Bay Area,Berkeley,US,4.3,1335916996000,1053,,,tech,,0,,
1979,Beyond The Basics - Photography Workshops,Hayward,US,4.91,1336022941000,203,,,photography,,0,,
1980,The Ponderful Meetup Group,Oakland,US,5,1336073492000,336,,,outdoors/adventure,,0,,
1981,Gay Asian Men and Admirers Get Together,San Francisco,US,4.83,1336239486000,471,,,LGBT,,0,,
1982,WebRTC Meetup Group,Palo Alto,US,5,1336251287000,305,,,tech,,0,,
1983,San Francisco Internet of Things Meetup (@SFIoTMeetup),San Francisco,US,4.62,1336452214000,4090,,,tech,,0,,
1984,Bay Area Sales Ops,San Francisco,US,4.6,1336493724000,179,,,tech,,0,,
1985,Speaker Jams!,Orinda,US,4.98,1336508997000,153,,,career/business,,0,,
1986,Data 2.0 Silicon Valley,Stanford,US,4.69,1336519103000,830,,,tech,,0,,
1987,Creative Practices at Studio Teobi,San Francisco,US,4.88,1336521701000,148,,,fine arts/culture,,0,,
1988,Maker Education,Oakland,US,5,1336582722000,239,,,education/learning,,0,,
1989,Trail running group,Oakland,US,4.99,1336584159000,49,,,outdoors/adventure,,0,,
1990,Awakened Living,San Francisco,US,4.94,1336612669000,996,,,new age/spirituality,,0,,
1991,The San Francisco Social Data and Analytics Group,San Francisco,US,4.57,1336681578000,653,,,tech,,0,,
1992,San Francisco Technology Channel Sales Group (TCSG),San Francisco,US,4.92,1336777108000,170,,,career/business,,0,,
1993,Mevident Wellness Practitioners Community,San Francisco,US,4.8,1336778046000,61,,,health/wellbeing,,0,,
1994,US/China Cross-border startups and entrepreneurs,Palo Alto,US,5,1336810730000,127,,,career/business,,0,,
1995,Beer.js SF,San Francisco,US,4.61,1336890069000,1878,,,tech,,0,,
1996,Bay Area Sloughers,Newark,US,4.56,1336960290000,35,,,outdoors/adventure,,0,,
1997,Customer Service Happy Hour,San Francisco,US,4.7,1337012535000,183,,,career/business,,0,,
1998,BASK: Bay Area Sea Kayakers,San Francisco,US,5,1337031025000,564,,,outdoors/adventure,,0,,
1999,Responsive Web Design SF,San Francisco,US,4.58,1337048467000,2370,,,tech,,0,,
2000,Peninsula Product Design Meetup,Redwood City,US,4.58,1337186044000,758,,,career/business,,0,,
2001,The Disqus Meetup Group,San Francisco,US,4.93,1337206839000,291,,,tech,,0,,
2002,Community Sailing SF Bay Meetup Group,San Francisco,US,4.86,1337238223000,595,,,outdoors/adventure,,0,,
2003,Soccer San Francisco,San Francisco,US,4.72,1337276537000,718,,,sports/recreation,,0,,
2004,PMS:  Proud Marin Sisters (and their friends) Meetup Group,Sausalito,US,4.84,1337282176000,467,,,LGBT,,0,,
2005,Bay Area Philosoverts,San Mateo,US,4.94,1337328189000,45,,,new age/spirituality,,0,,
2006,The Young Entrepreneur Network,San Francisco,US,4.75,1337367419000,571,,,career/business,,0,,
2007,Get More Speaking Gigs - Bay Area,Pleasant Hill,US,4.91,1337367975000,141,,,career/business,,0,,
2008,Gay Bowling Meet & Greet SF,San Francisco,US,4.67,1337369982000,387,,,LGBT,,0,,
2009,Peninsula Polyamory,Menlo Park,US,4.76,1337576927000,392,,,alternative lifestyle,,0,,
2010,Dolores Park Tennis Club,San Francisco,US,4.84,1337626014000,455,,,sports/recreation,,0,,
2011,Social Sales,San Francisco,US,5,1337636554000,327,,,tech,,0,,
2012,Modeling Seminars of America,San Francisco,US,4.44,1337647345000,62,,,fine arts/culture,,0,,
2013,Berkeley-Oakland-East Bay Hardware Startup Meetup,Berkeley,US,4.59,1337707856000,1014,,,career/business,,0,,
2014,Social Media Marketing Monitoring Engagement San Francisco,San Francisco,US,4.44,1337878252000,968,,,career/business,,0,,
2015,Hiring Success,San Francisco,US,4.72,1337903168000,677,,,career/business,,0,,
2016,Mon/Thur Night Improv Classes,San Francisco,US,4.92,1337974977000,889,,,fine arts/culture,,0,,
2017,Silicon Valley Educator Network (SVEN),Menlo Park,US,4.61,1337988768000,25,,,education/learning,,0,,
2018,My Front Porch in Palo Alto - an intentional community,Palo Alto,US,4.46,1338071553000,142,,,socializing,,0,,
2019,Dating Skills for Single Women,Emeryville,US,4.67,1338236371000,169,,,singles,,0,,
2020,MBA Lessons / Business Networking,San Francisco,US,4.14,1338346888000,546,,,career/business,,0,,
2021,Bay Area Premier Women's Business Network,San Francisco,US,5,1338357096000,196,,,career/business,,0,,
2022,Pivotal Labs SF,San Francisco,US,4.71,1338403451000,1188,,,tech,,0,,
2023,Mobile Security and Privacy,San Francisco,US,5,1338403575000,310,,,tech,,0,,
2024,New Yorker Magazine Lovers in SF,San Francisco,US,4.72,1338415123000,339,,,fine arts/culture,,0,,
2025,Cooking in San Francisco,San Francisco,US,5,1338474541000,331,,,food/drink,,0,,
2026,Bay Area Lua Developers,San Francisco,US,4.63,1338484279000,147,,,tech,,0,,
2027,Meditation - Mill Valley,Mill Valley,US,5,1338494701000,15,,,health/wellbeing,,0,,
2028,AngularJS-SF,San Francisco,US,4.53,1338498929000,3113,,,tech,,0,,
2029,Friends of Jack London,Oakland,US,4.44,1338521455000,221,,,community/environment,,0,,
2030,Sensored (SF),San Francisco,US,4.87,1338589028000,1661,,,tech,,0,,
2031,Rodgers Ranch Urban Farm and Teaching Gardens,Pleasant Hill,US,4.96,1338676525000,579,,,community/environment,,0,,
2032,Active 420,San Carlos,US,4.63,1338777663000,397,,,socializing,,0,,
2033,Dance for Charity,San Francisco,US,0,1338785566000,251,,,community/environment,,0,,
2034,Chabot Digital Photo Freeschool,Hayward,US,5,1338833094000,233,,,photography,,0,,
2035,Coworking Walnut Creek,Walnut Creek,US,4.83,1338865402000,226,,,career/business,,0,,
2036,"All Things API: Rest, Cloud, Integrations, Mashups, and SaaS",San Francisco,US,4.52,1338920801000,890,,,tech,,0,,
2037,Diablo Valley Mastery for Women,Danville,US,4.8,1338924782000,144,,,socializing,,0,,
2038,Startup California Bay Area,San Francisco,US,4.91,1338928037000,1745,,,career/business,,0,,
2039,Politics+JS meetup,San Francisco,US,4.33,1338993309000,145,,,tech,,0,,
2040,Concord/East Bay Board Games,Concord,US,4.86,1339029552000,265,,,games,,0,,
2041,Yuppie Friday,San Francisco,US,5,1339097240000,92,,,community/environment,,0,,
2042,Developing with Data in San Francisco,San Francisco,US,4.92,1339100460000,1346,,,tech,,0,,
2043,Our Village Mom's Club - Fit4Mom Marin - Stroller Strides,San Rafael,US,4.92,1339133746000,135,,,parents/family,,0,,
2044,Startups-Business-Intelligence,Redwood City,US,4.71,1339175615000,1124,,,tech,,0,,
2045,Bay Area Internet of Things,Palo Alto,US,4.98,1339187660000,612,,,tech,,0,,
2046,Liminal Art Salon®,Oakland,US,5,1339188046000,104,,,new age/spirituality,,0,,
2047,Node Summit,Palo Alto,US,0,1339202252000,192,,,tech,,0,,
2048,Keep people out of your energy (personal boundaries),Mill Valley,US,0,1339275247000,14,,,health/wellbeing,,0,,
2049,University of the Commons,San Francisco,US,4.95,1339285325000,326,,,education/learning,,0,,
2050,Bay Area Boom Swingers! (Electro Swing in SF and beyond),San Francisco,US,4.83,1339305680000,706,,,dancing,,0,,
2051,San Francisco Steampunk Dance Group,San Francisco,US,5,1339308685000,212,,,games,,0,,
2052,Alameda Volleyball and Beer,Alameda,US,4.94,1339357661000,908,,,sports/recreation,,0,,
2053,SOMA Salesforce.com Power Players,San Francisco,US,4.34,1339447712000,165,,,tech,,0,,
2054,Peninsula Peace and Justice,Palo Alto,US,0,1339556687000,54,,,movements/politics,,0,,
2055,Continuous Delivery San Francisco,San Francisco,US,4.4,1339596569000,893,,,tech,,0,,
2056,EdgeSpring Meetup Group,San Mateo,US,4.9,1339606248000,184,,,tech,,0,,
2057,East Bay Vocal Empowerment Group,Alameda,US,4.9,1339610794000,167,,,music,,0,,
2058,Addiction Motors Motorcycle Meetup,Richmond,US,4.56,1339619944000,354,,,cars/motorcycles,,0,,
2059,S.F. Fans of Stand-Up Comedy,San Francisco,US,4.64,1339624599000,319,,,socializing,,0,,
2060,Art Journaling,San Francisco,US,4.8,1339635209000,122,,,hobbies/crafts,,0,,
2061,Wikipedia Tech,San Francisco,US,4.67,1339637502000,567,,,tech,,0,,
2062,Bay Area Tizen App Developers Meetup,Palo Alto,US,3.5,1339702478000,69,,,tech,,0,,
2063,San Francisco Agile Marketing,San Francisco,US,4.58,1339802824000,3577,,,tech,,0,,
2064,Bay Area Practice Daters,Emeryville,US,4.72,1339896258000,315,,,singles,,0,,
2065,"Bay Area Spring Water, Wild Food, and Vitality Meetup Group",San Anselmo,US,4.97,1339914780000,569,,,food/drink,,0,,
2066,SF Evening Rotary Club,San Francisco,US,4.65,1340070215000,267,,,community/environment,,0,,
2067,"ERIE: Entheogenic Research, Integration, and Education",San Francisco,US,4.77,1340162538000,1343,,,new age/spirituality,,0,,
2068,Writing Excursions with Clive Matson,Oakland,US,0,1340209346000,108,,,writing,,0,,
2069,Beyond 40,San Francisco,US,4.4,1340249441000,1050,,,socializing,,0,,
2070,AMPP - Association of Minority Professional Photographers,San Leandro,US,4.58,1340256776000,127,,,photography,,0,,
2071,✦FUN Girlfriends (20s✦30s) San Francisco✦,San Francisco,US,4.8,1340321876000,929,,,socializing,,0,,
2072,SF Squaw Valley Ski and Snowboard Party People,San Francisco,US,4.83,1340334371000,308,,,singles,,0,,
2073,Startup Development,San Francisco,US,4.14,1340375385000,866,,,tech,,0,,
2074,"Eat, drink & sing !",San Francisco,US,4.89,1340407702000,180,,,music,,0,,
2075,East Bay Family Ping-Pong,Alameda,US,5,1340424221000,17,,,sports/recreation,,0,,
2076,Spontaneous Fun People in San Francisco,San Francisco,US,4.58,1340470985000,769,,,socializing,,0,,
2077,East Bay Zumba and Afro-Funk Fusion Fitness,Hayward,US,4.96,1340492398000,154,,,fitness,,0,,
2078,Sierra Nevada Mountain Climbing,San Rafael,US,5,1340677002000,405,,,outdoors/adventure,,0,,
2079,Silicon Barn Entrepreneurs,San Mateo,US,4.88,1340682028000,170,,,tech,,0,,
2080,Silicon Barn - Startup Launchers,San Mateo,US,0,1340687127000,113,,,tech,,0,,
2081,The Pixel-Flick TV Alliance,Burlingame,US,4.5,1340750161000,78,,,movies/film,,0,,
2082,Destination Earth: Adventures with Meaning!,San Francisco,US,0,1340812419000,949,,,outdoors/adventure,,0,,
2083,Black Women Who Want More - Oakland Chapter,Oakland,US,4.47,1340842187000,207,,,health/wellbeing,,0,,
2084,"Marin Singles Hiking, Dining, and Social Club",San Rafael,US,4.63,1340844497000,733,,,outdoors/adventure,,0,,
2085,Bay Area Triathlon & Cycling Training,San Francisco,US,4.81,1340860347000,518,,,fitness,,0,,
2086,San Francisco Twisted Python Meetup,San Francisco,US,4.84,1340989233000,257,,,tech,,0,,
2087,San Francisco PyData,San Francisco,US,4.73,1340992150000,1472,,,tech,,0,,
2088,San Anselmo Innovators,San Anselmo,US,4.88,1341079814000,40,,,career/business,,0,,
2089,Multicultural mid 20s -40s,San Francisco,US,4.71,1341079951000,1170,,,socializing,,0,,
2090,Sunset & Richmond 20 & 30-somethings,San Francisco,US,4.83,1341087984000,742,,,socializing,,0,,
2091,East Bay Latinas Meetup,Oakland,US,4.87,1341182896000,398,,,language/ethnic identity,,0,,
2092,Bay Area Broomball,San Mateo,US,0,1341193901000,66,,,sports/recreation,,0,,
2093,Women Owned Networking 100 - Peninsula,San Carlos,US,4.93,1341208019000,245,,,career/business,,0,,
2094,Nihongo Moriagari: Japanese Language Meetup,San Francisco,US,4.86,1341262832000,1610,,,language/ethnic identity,,0,,
2095,"Bay Area Nerds, Geeks and Gamers",San Francisco,US,3.43,1341267645000,984,,,sci-fi/fantasy,,0,,
2096,Mobile Monday Silicon Valley,San Francisco,US,4.45,1341299286000,3873,,,tech,,0,,
2097,Dating for Nerds Bay Area,San Francisco,US,4,1341348177000,597,,,singles,,0,,
2098,Flirt Camp SF,San Francisco,US,5,1341515051000,481,,,singles,,0,,
2099,Bay Area Very Small Group Backpackers,Palo Alto,US,5,1341515125000,528,,,outdoors/adventure,,0,,
2100,VideoStreaming,San Francisco,US,4.25,1341524649000,100,,,tech,,0,,
2101,Portals to the Earth's Soul   www.breathofcreation.org,San Francisco,US,4.71,1341526316000,100,,,new age/spirituality,,0,,
2102,Parents of 2-6 year olds,Berkeley,US,3.92,1341534504000,218,,,parents/family,,0,,
2103,startupPerColator Series,Palo Alto,US,5,1341615722000,100,,,career/business,,0,,
2104,East Bay Tiny House Enthusiasts,Oakland,US,4.59,1341704327000,1024,,,community/environment,,0,,
2105,San Mateo Flag Football,San Mateo,US,4.76,1341706815000,491,,,sports/recreation,,0,,
2106,Qigong in the Park,San Mateo,US,4.97,1341770967000,340,,,health/wellbeing,,0,,
2107,Urban Hiking & Happy Hour (& random urban adventures),San Francisco,US,4.8,1341784196000,5750,,,socializing,,0,,
2108,Bay Area Art and Culture Meet Up,San Rafael,US,4.71,1341790173000,45,,,socializing,,0,,
2109,GetToned! Fitness Group,Hayward,US,4.95,1341840202000,236,,,fitness,,0,,
2110,Shifting Gears: Women in Career Transition,San Francisco,US,4.85,1341849699000,473,,,career/business,,0,,
2111,West Coast Poker League,Walnut Creek,US,4.88,1341875279000,222,,,games,,0,,
2112,Oddball Adventures,San Francisco,US,4.67,1341954078000,191,,,outdoors/adventure,,0,,
2113,San Francisco Bay Area Highly Sensitive Person (HSP) Group,San Francisco,US,4.68,1342010087000,806,,,socializing,,0,,
2114,Sports and tech meetup (bay area),San Francisco,US,4.76,1342046936000,2170,,,tech,,0,,
2115,Silicon Valley TechMeetups,San Francisco,US,5,1342111148000,164,,,career/business,,0,,
2116,Queer Theory Book Group!,Oakland,US,4.32,1342118161000,363,,,LGBT,,0,,
2117,Connected Real Estate Investors in Oakland,Oakland,US,4.97,1342121889000,309,,,career/business,,0,,
2118,Predictably Well,San Francisco,US,4.85,1342122860000,107,,,health/wellbeing,,0,,
2119,Montage Developers of Silicon Valley,San Francisco,US,5,1342138534000,81,,,tech,,0,,
2120,Burlingame Soccer,Burlingame,US,4.68,1342142744000,622,,,sports/recreation,,0,,
2121,The Gentleman Playboy SF (Attracting Women of Your Dreams),San Francisco,US,4.5,1342162261000,6,,,singles,,0,,
2122,Future of the Book,San Francisco,US,4.58,1342199033000,194,,,tech,,0,,
2123,Sacred Sound Ceremonies,Alameda,US,0,1342244236000,49,,,new age/spirituality,,0,,
2124,Scentsational Dogs in the Redwood City Area,Redwood City,US,4.5,1342285585000,45,,,pets/animals,,0,,
2125,Bay Area SUSE Meetup,San Francisco,US,5,1342313258000,55,,,tech,,0,,
2126,Meditations in Nature,Oakland,US,0,1342335257000,51,,,health/wellbeing,,0,,
2127,Oakland Energy Healers,Oakland,US,4.85,1342391036000,909,,,health/wellbeing,,0,,
2128,Capoeira Conditioning for Cross Trainers,Emeryville,US,5,1342403883000,222,,,fitness,,0,,
2129,The SF Henri Bergson & Friends Society,San Francisco,US,5,1342410432000,34,,,education/learning,,0,,
2130,"Silicon Sun - Programmers, Start-Ups and Entrepreneurs",Palo Alto,US,4.71,1342414104000,473,,,tech,,0,,
2131,Fog City Faithful-Seattle Sounders Supporters Regional Group,San Francisco,US,4.83,1342423726000,111,,,sports/recreation,,0,,
2132,Oracle NoSQL & Big Data Meetup,Redwood City,US,4.63,1342459904000,605,,,tech,,0,,
2133,Lean Palo Alto,Palo Alto,US,0,1342487787000,36,,,tech,,0,,
2134,Bay Area Spiritual Seekers,Berkeley,US,4.17,1342524220000,93,,,new age/spirituality,,0,,
2135,New Delhi India PhoneGap Meetup Group,San Carlos,US,0,1342525765000,4,,,tech,,0,,
2136,El Sobrante Storytelling SWAP,El Sobrante,US,4.5,1342548989000,25,,,fine arts/culture,,0,,
2137,Non Stop Bhangra,San Francisco,US,4.71,1342552646000,613,,,language/ethnic identity,,0,,
2138,"First Time Moms - East Bay, CA",Walnut Creek,US,4.87,1342553743000,936,,,parents/family,,0,,
2139,Desi moms East bay (Walnut Creek/Concord/Pleasant Hill),Walnut Creek,US,4.97,1342554382000,98,,,parents/family,,0,,
2140,Tan Your Hide Primitive Skill Share,Alameda,US,5,1342557320000,87,,,community/environment,,0,,
2141,playthebay,San Francisco,US,5,1342558406000,102,,,socializing,,0,,
2142,SF Muslims,San Francisco,US,4.86,1342558409000,572,,,socializing,,0,,
2143,Eye of Newt,San Francisco,US,5,1342565491000,99,,,new age/spirituality,,0,,
2144,Third Workplace - East Bay Work Community,Walnut Creek,US,4.62,1342565594000,58,,,career/business,,0,,
2145,BayBio,South San Francisco,US,4.38,1342569489000,318,,,education/learning,,0,,
2146,The Power of Mother: Everyone's Story,San Francisco,US,0,1342571085000,5,,,support,,0,,
2147,Marin Dance Meditation,Fairfax,US,4.75,1342571442000,68,,,health/wellbeing,,0,,
2148,IT Ukrainians in the Bay Area,Menlo Park,US,5,1342574829000,101,,,career/business,,0,,
2149,Marin Mergers Executive Networking Group,Larkspur,US,5,1342578748000,5,,,career/business,,0,,
2150,San Mateo Montessori Elementary Activity Group,San Mateo,US,4.7,1342584733000,65,,,sports/recreation,,0,,
2151,Conscious Women Creating A New Health Paradigm,San Francisco,US,4.67,1342594229000,11,,,health/wellbeing,,0,,
2152,SF Sustainable Fashion & Independent Design,San Francisco,US,4,1342627790000,437,,,fashion/beauty,,0,,
2153,Buddy Squad San Francisco,San Francisco,US,4,1342634163000,27,,,socializing,,0,,
2154,Fin-Hack,San Francisco,US,4,1342641123000,138,,,tech,,0,,
2155,"Story Swaps, Storytelling Performances, and Workshops",Berkeley,US,4.78,1342649471000,396,,,fine arts/culture,,0,,
2156,Bay Area Vegan Food Lovers,Oakland,US,4.85,1342723015000,820,,,food/drink,,0,,
2157,WomenLaunch - Women Startup Accelerator,San Francisco,US,4.79,1342752925000,156,,,career/business,,0,,
2158,Bay Area Women's Hiking Group,San Francisco,US,4.83,1342978659000,1156,,,outdoors/adventure,,0,,
2159,PageLines Forum,San Francisco,US,0,1343062619000,7,,,tech,,0,,
2160,App-Fund in Silicon Valley,Palo Alto,US,4.55,1343079351000,260,,,career/business,,0,,
2161,The Fireside Lounge's Singer/ Songwriter Open MIC,Alameda,US,4.83,1343080956000,480,,,music,,0,,
2162,Indiegogo - Crowdfunding meetups,San Francisco,US,4.24,1343096592000,1379,,,career/business,,0,,
2163,California Jedi,Berkeley,US,5,1343142124000,105,,,sci-fi/fantasy,,0,,
2164,SF Autodesk Animation User Group,San Francisco,US,0,1343168955000,97,,,tech,,0,,
2165,San Francisco Softball Community,San Francisco,US,4.92,1343239414000,1002,,,sports/recreation,,0,,
2166,Mobile Music Meetup,San Francisco,US,5,1343254212000,154,,,music,,0,,
2167,San Francisco Quantified Self Meetup Group,San Francisco,US,4.83,1343256475000,973,,,tech,,0,,
