,group_name,city,country,ratings,created_date,members,last_event,next_event,category,primary_topic,membership_fees,last_event_rsvp,next_event_rsvp
5985,Women Who Go,San Francisco,US,5,1432439539000,226,,,tech,,0,,
5986,Oakland Freaks and Geeks Meetup,Oakland,US,0,1432443401000,12,,,socializing,,0,,
5987,"Ladies Happy Hours!!! (Bay Area, 20s and 30s)",Palo Alto,US,5,1432446772000,71,,,socializing,,0,,
5988,San Francisco Life Hackers,San Francisco,US,5,1432599567000,54,,,health/wellbeing,,0,,
5989,Effective Altruism Bay Area,San Francisco,US,0,1432616289000,195,,,education/learning,,0,,
5990,Digital Health Summit & Digital Health Live Meetup,San Francisco,US,0,1432650438000,84,,,tech,,0,,
5991,Emperor Norton San Francisco Pagan Society,San Francisco,US,5,1432664791000,85,,,new age/spirituality,,0,,
5992,Make Your Own Hat,San Francisco,US,0,1432671479000,36,,,hobbies/crafts,,0,,
5993,BayArea parents for healthy kids,San Francisco,US,5,1432675313000,89,,,parents/family,,0,,
5994,Oakland Coloring For Fun and Relaxation Group,Oakland,US,5,1432691511000,257,,,hobbies/crafts,,0,,
5995,Alameda Purposeful Living Meetup,Alameda,US,0,1432697036000,28,,,health/wellbeing,,0,,
5996,Fun Happy Hour Friends -- Private Group,San Mateo,US,0,1432697598000,38,,,socializing,,0,,
5997,San Francisco Dogs Meetup-BarkswellSF,San Francisco,US,5,1432760674000,254,,,pets/animals,,0,,
5998,Essential Leadership Group,Emeryville,US,0,1432786021000,127,,,career/business,,0,,
5999,CannaTech San Francisco,San Francisco,US,0,1432786580000,135,,,movements/politics,,0,,
6000,"KOREA-US ""KORUS"" Cultural Exchange Foundation",San Francisco,US,0,1432792718000,107,,,language/ethnic identity,,0,,
6001,SF Urban Tea Tasting,San Francisco,US,5,1432796035000,50,,,food/drink,,0,,
6002,Das Auto Tech Talks - Hosted by Volkswagen Group of America,Belmont,US,4.83,1432826684000,355,,,tech,,0,,
6003,The Food Node - Getting You Connected at the Table,Oakland,US,0,1432832500000,173,,,career/business,,0,,
6004,"World Music, Dance, and Yoga Collective",San Francisco,US,0,1432835552000,49,,,fine arts/culture,,0,,
6005,WomenWhoMake,Oakland,US,0,1432846878000,9,,,tech,,0,,
6006,Alameda/Oakland Ladies Movie and Hangout Meetup (20's-30's),Alameda,US,5,1432859292000,151,,,movies/film,,0,,
6007,Walnut Creek Women's Entreprenuer networking Meetup,Walnut Creek,US,1,1432860551000,70,,,career/business,,0,,
6008,Walnut Creek Retired Women...NOW WHAT!!!!,Walnut Creek,US,4.93,1432886370000,112,,,socializing,,0,,
6009,Michael Tellinger - Ancient Civilisations & UBUNTU,San Francisco,US,0,1432918969000,34,,,new age/spirituality,,0,,
6010,1KE Tech Talks,San Francisco,US,0,1432926466000,75,,,tech,,0,,
6011,Yoga for Recovery Meetup (Millbrae),Millbrae,US,5,1432932030000,103,,,health/wellbeing,,0,,
6012,Craft Your Ideal Business,San Rafael,US,4.5,1432939452000,21,,,career/business,,0,,
6013,UXSF: Usability San Francisco,San Francisco,US,0,1432941589000,226,,,tech,,0,,
6014,East Bay Half-Marathon Neighbor-Walkers,Oakland,US,0,1432951486000,50,,,education/learning,,0,,
6015,Soulful Yoga Flow in Washington Square- by donation,San Francisco,US,0,1432990957000,119,,,health/wellbeing,,0,,
6016,Menlo Park Tennis Clinic Drop-In,Menlo Park,US,0,1433023457000,77,,,sports/recreation,,0,,
6017,Best Night Ever!,Walnut Creek,US,3,1433047646000,169,,,socializing,,0,,
6018,Burlingame Social Meetup,San Mateo,US,5,1433052249000,317,,,socializing,,0,,
6019,Bucket-List Adventures,Fairfax,US,0,1433065883000,53,,,outdoors/adventure,,0,,
6020,DDA Live BEST CLASSIC ROCK AND DANCE Music Meetup,Pleasant Hill,US,0,1433101647000,45,,,music,,0,,
6021,Profit From Your Passion and Genius,San Rafael,US,5,1433124755000,7,,,career/business,,0,,
6022,East Bay Strategic Thinking Leaders' Huddle,Oakland,US,5,1433182536000,38,,,career/business,,0,,
6023,Thriving Women in Business Group East Bay,Pleasant Hill,US,0,1433182619000,116,,,career/business,,0,,
6024,SF Financial District Frisbee Lunch Hour,San Francisco,US,5,1433187293000,100,,,sports/recreation,,0,,
6025,Thriving Women in Business Group South Bay,Palo Alto,US,0,1433193019000,104,,,career/business,,0,,
6026,Millbrae Parents of Special Needs Children Meetup,Millbrae,US,0,1433195100000,18,,,parents/family,,0,,
6027,Double Touch Healing ~ SF/Peninsula Area,San Mateo,US,0,1433202538000,49,,,health/wellbeing,,0,,
6028,Weekly Group Healing Meditations,San Francisco,US,0,1433220617000,160,,,health/wellbeing,,0,,
6029,Walnut Creek Asian Moms Meetup,Walnut Creek,US,4.88,1433225641000,45,,,parents/family,,0,,
6030,"Ladies, Technically Speaking... (Bay Area)",Oakland,US,4.67,1433281766000,103,,,tech,,0,,
6031,Happy Goats - Theatre and Performance Acting meet up -,San Francisco,US,5,1433283713000,76,,,fine arts/culture,,0,,
6032,San Francisco Tapping Into Weight Loss Support Meetup,San Francisco,US,0,1433285834000,57,,,health/wellbeing,,0,,
6033,San Francisco Bay TestOps,San Francisco,US,0,1433294590000,46,,,tech,,0,,
6034,SF Bay Area Revamp Your Life and Career in 6 months Meetup,San Francisco,US,4.67,1433306664000,36,,,career/business,,0,,
6035,San Francisco Lesbian Happy Hour,San Francisco,US,4.93,1433307999000,710,,,LGBT,,0,,
6036,We Are Fintech San Francisco,San Francisco,US,4.9,1433308366000,566,,,career/business,,0,,
6037,National Association of Women Property Investors-Oakland/SF,Oakland,US,5,1433352800000,162,,,career/business,,0,,
6038,Downtown Redwood City Church Gathering,Redwood City,US,0,1433370638000,26,,,religion/beliefs,,0,,
6039,Hunt for SF Pop-Ups & Supperclubs!,San Francisco,US,0,1433374661000,196,,,food/drink,,0,,
6040,Sustainability Enthusiasts Disccussion Group - San Francisco,San Francisco,US,5,1433383287000,27,,,community/environment,,0,,
6041,"OpenSMC, a Code for America Brigade for County of San Mateo",Redwood City,US,4.83,1433391214000,173,,,tech,,0,,
6042,East Bay SMART Board Collaborative Group,San Leandro,US,0,1433392373000,22,,,education/learning,,0,,
6043,Dover Publications' Adult Coloring Parties!,San Francisco,US,5,1433440867000,429,,,hobbies/crafts,,0,,
6044,San Francisco Open Drinks,San Francisco,US,5,1433444656000,163,,,tech,,0,,
6045,45+ Singles' Trivia & More! Menlo Park & Neighbors of MP!,Menlo Park,US,5,1433445944000,183,,,singles,,0,,
6046,Berkeley Nightowls,Berkeley,US,5,1433451079000,459,,,tech,,0,,
6047,Newark  Handmade Crafts Meetup,Fremont,US,0,1433456510000,5,,,fashion/beauty,,0,,
6048,Mobile Makers Academy San Francisco,San Francisco,US,0,1433524133000,255,,,tech,,0,,
6049,Travel Meetup Friends,San Francisco,US,0,1433538003000,841,,,outdoors/adventure,,0,,
6050,Developer Companies > Soap Box Speaker series,San Francisco,US,5,1433549716000,133,,,tech,,0,,
6051,"TGQMM - Trans* & Genderqueer Mindfulness Meetup, Oakland",Oakland,US,5,1433566521000,77,,,new age/spirituality,,0,,
6052,Women's Yoga and Community Gathering,Albany,US,0,1433607013000,104,,,new age/spirituality,,0,,
6053,Palo Alto Business Referral Network (Palo Alto BRN),Palo Alto,US,5,1433613345000,74,,,career/business,,0,,
6054,Bay Area Electric Micro Unicycles Club,Berkeley,US,5,1433617439000,68,,,community/environment,,0,,
6055,Spark Global Online Meetup,San Francisco,US,4.5,1433637044000,1103,,,tech,,0,,
6056,Procrastination to Productivity Meetup,Fremont,US,0,1433721818000,106,,,education/learning,,0,,
6057,Palo Alto Engineering Management Meetup,Palo Alto,US,0,1433742083000,59,,,tech,,0,,
6058,The Kloyz: A Jewish Study & Discussion Group,Palo Alto,US,4.9,1433791155000,49,,,religion/beliefs,,0,,
6059,APIs and IoT San Francisco,San Francisco,US,0,1433796648000,200,,,tech,,0,,
6060,"Fremont/Bay Area Fun, Active New Moms!",Fremont,US,4.44,1433799485000,178,,,parents/family,,0,,
6061,The High Vibe Tribe Meetup,Oakland,US,0,1433802215000,61,,,new age/spirituality,,0,,
6062,Bay Area Entrepreneur Mastermind Group,Oakland,US,4.67,1433806389000,304,,,career/business,,0,,
6063,Through The Tunnel and into the LGBTQ!,Lafayette,US,0,1433824817000,254,,,LGBT,,0,,
6064,Peninsula NoSQL Meetup,San Carlos,US,4.75,1433865577000,151,,,tech,,0,,
6065,SF Twitter Developer Group,San Francisco,US,5,1433875825000,317,,,tech,,0,,
6066,LifeRing Marin Secular Recovery Groups,San Rafael,US,0,1433945221000,13,,,support,,0,,
6067,San Francisco Bay Area Cleaning Meetup,San Francisco,US,0,1433957153000,3,,,hobbies/crafts,,0,,
6068,Western SOMA Administrative Roles Meetup,San Francisco,US,5,1433959843000,76,,,career/business,,0,,
6069,Oaktown Founder Conspiracy,Oakland,US,4.5,1433965416000,157,,,tech,,0,,
6070,Brazil in the City,San Francisco,US,5,1433966688000,125,,,language/ethnic identity,,0,,
6071,#Flyday: Berkeley Drones,Berkeley,US,4.75,1433972013000,302,,,hobbies/crafts,,0,,
6072,LFSF Surf Meetup,San Francisco,US,0,1433983008000,12,,,sports/recreation,,0,,
6073,Woven: East Bay Women Connecting Meetup,Oakland,US,4.94,1434041450000,435,,,socializing,,0,,
6074,San Francisco Bike Kitchen's Social Rides,San Francisco,US,4.75,1434045559000,209,,,outdoors/adventure,,0,,
6075,Art of Feminine Presence Group-Be a Magnetic Woman,Berkeley,US,5,1434048521000,192,,,new age/spirituality,,0,,
6076,PicsArt PopUps,San Francisco,US,5,1434052290000,277,,,photography,,0,,
6077,Mandarin-English Creative Living Group,San Francisco,US,0,1434058479000,15,,,health/wellbeing,,0,,
6078,Her Concierge Society-Contra Costa,Walnut Creek,US,5,1434062615000,100,,,career/business,,0,,
6079,Marin Networking for Service-Based Businesses,San Rafael,US,4.4,1434066003000,69,,,career/business,,0,,
6080,Peninsula Healthy Living Meetup,San Mateo,US,4.93,1434072986000,86,,,health/wellbeing,,0,,
6081,Bay Area Bunny Rabbit Hop & Tea Club,San Francisco,US,5,1434073781000,19,,,pets/animals,,0,,
6082,FABULOUS &  FORTY,San Francisco,US,5,1434080878000,114,,,socializing,,0,,
6083,Bay Area Women in Technology Meetup,San Francisco,US,5,1434084613000,647,,,tech,,0,,
6084,Growth Hacking Tactics and Community Building,San Francisco,US,5,1434085134000,169,,,career/business,,0,,
6085,SF Bay Area Tech Interviews,San Francisco,US,4.71,1434127173000,643,,,tech,,0,,
6086,Burlingame Lealand Tea Family,Burlingame,US,0,1434150002000,109,,,food/drink,,0,,
6087,Find and Release Your Inner Sound: Beatbox Prana-Yoga,Berkeley,US,0,1434175657000,39,,,health/wellbeing,,0,,
6088,Bay Area Elixir Meetup,San Francisco,US,4.86,1434210317000,277,,,tech,,0,,
6089,East Bay EPP's & Friends,Alameda,US,4.73,1434219039000,29,,,hobbies/crafts,,0,,
6090,AG Coffee,Palo Alto,US,0,1434251410000,50,,,career/business,,0,,
6091,City Strolls with a Camera,San Francisco,US,4.39,1434259295000,285,,,photography,,0,,
6092,SF Figure Drawing/Painting Meetup. Thursday MISSION,San Francisco,US,5,1434273311000,230,,,fine arts/culture,,0,,
6093,Master Sha's Soul Healing Group Rodeo,Rodeo,US,0,1434284535000,22,,,new age/spirituality,,0,,
6094,"Fun, cool, happy lawyers",Novato,US,0,1434344082000,12,,,movements/politics,,0,,
6095,Women's Health Down There - SF Chapter,San Francisco,US,0,1434389217000,23,,,health/wellbeing,,0,,
6096,adventure time,San Francisco,US,0,1434391165000,6,,,outdoors/adventure,,0,,
6097,It Takes a Village-Single Parents Meet-up,Oakland,US,5,1434392210000,101,,,parents/family,,0,,
6098,Coastside Healthy Living Enthusiasts,Half Moon Bay,US,5,1434392590000,103,,,fitness,,0,,
6099,Health Impact,San Francisco,US,4.5,1434399966000,611,,,tech,,0,,
6100,OpenTable Tech Talks,San Francisco,US,5,1434402125000,390,,,tech,,0,,
6101,Machine Learning for Hardware,San Francisco,US,5,1434409248000,107,,,tech,,0,,
6102,Maptime Silicon Valley,Palo Alto,US,5,1434421247000,100,,,tech,,0,,
6103,IT Sales and Delivery Professionals,Fremont,US,0,1434421266000,18,,,career/business,,0,,
6104,"Ladies Social - Weight loss, friendship & wealth creation!",San Francisco,US,5,1434425622000,168,,,health/wellbeing,,0,,
6105,SF Shoegaze & Dreampop,San Francisco,US,0,1434438975000,34,,,music,,0,,
6106,Welcome All & we mean all.  We are spiritual but not churchy,Redwood City,US,0,1434458610000,23,,,religion/beliefs,,0,,
6107,Detour Walking Club,San Francisco,US,5,1434479954000,409,,,socializing,,0,,
6108,"First Church of Religious Science, Vallejo",Vallejo,US,0,1434494545000,18,,,new age/spirituality,,0,,
6109,Radical Light Center for Spiritual Living,Oakland,US,0,1434516662000,31,,,new age/spirituality,,0,,
6110,SF Bay Photo Walks,San Francisco,US,4.73,1434520015000,1484,,,photography,,0,,
6111,"Walnut creek - Active Singles Hiking,Biking,Happy hour",Walnut Creek,US,4.79,1434554596000,760,,,singles,,0,,
6112,SF Drug-free anxiety busters,San Francisco,US,0,1434565139000,86,,,health/wellbeing,,0,,
6113,Novato Dog Party with A Purpose,Novato,US,5,1434584274000,46,,,pets/animals,,0,,
6114,Selected Shorts Listening Party,Oakland,US,0,1434600664000,22,,,book clubs,,0,,
6115,ENJOY North Bay,San Francisco,US,0,1434605543000,128,,,tech,,0,,
6116,Customer Success - Silicon Valley,San Mateo,US,5,1434643012000,155,,,tech,,0,,
6117,Let's go to Italy!! Travel Meetup,San Francisco,US,0,1434644619000,61,,,outdoors/adventure,,0,,
6118,NGINX Meetup,San Francisco,US,4,1434649150000,211,,,tech,,0,,
6119,EmpowerFIT Boot Camp at Palo Alto High School,Palo Alto,US,0,1434653651000,50,,,fitness,,0,,
6120,Onshape Users – San Francisco,San Francisco,US,5,1434656098000,137,,,tech,,0,,
6121,Emeryville Divine Vocalists Meetup,Emeryville,US,0,1434656467000,57,,,health/wellbeing,,0,,
6122,ENJOY East Bay,Oakland,US,5,1434663861000,161,,,photography,,0,,
6123,Bay Area Real Estate Market for Buyers and Sellers Meetup,Berkeley,US,0,1434670533000,81,,,career/business,,0,,
6124,Martinez Infusionsoft Users and Business Strategies Meetup,Martinez,US,0,1434678715000,10,,,career/business,,0,,
6125,South Bay Wedding Planning Meetup,Palo Alto,US,0,1434688823000,10,,,fashion/beauty,,0,,
6126,Paleoventures Outdoor Team Building Preview,Walnut Creek,US,0,1434688842000,35,,,career/business,,0,,
6127,San Francisco Area Infusionsoft Users Hangout Meetup,Oakland,US,0,1434734441000,13,,,career/business,,0,,
6128,East Bay Child Centered Learning Group,Berkeley,US,0,1434751257000,47,,,parents/family,,0,,
6129,The East Bay Integral Yoga Group,Pinole,US,0,1434757331000,46,,,new age/spirituality,,0,,
6130,San Francisco Expatriados españoles y descendientes Meetup,San Francisco,US,4.75,1434771695000,111,,,language/ethnic identity,,0,,
6131,San Francisco Acoustic Jams Meetup,San Francisco,US,5,1434773880000,99,,,music,,0,,
6132,San Francisco Homesteading Meetup,San Francisco,US,0,1434775445000,24,,,food/drink,,0,,
6133,San Francisco UX Design and Development Professionals,San Francisco,US,0,1434777416000,595,,,tech,,0,,
6134,Cups and Queens,Oakland,US,5,1434832325000,12,,,movements/politics,,0,,
6135,Oakland Healing through Forgiveness Meetup,Oakland,US,0,1434836291000,91,,,new age/spirituality,,0,,
6136,KIMONO de JACK San Francisco Bay Area,Oakland,US,5,1434836869000,43,,,language/ethnic identity,,0,,
6137,Walnut Creek Career Development & Planning Meetup,Walnut Creek,US,0,1434839864000,34,,,career/business,,0,,
6138,San Francisco Uncover the Truth- Sealed Alien Files,San Francisco,US,0,1434859164000,37,,,paranormal,,0,,
6139,OUTGOING INTROVERTS. connections w. like-minded ladies -BAY,Oakland,US,5,1434863077000,2,,,socializing,,0,,
6140,Friends of Sarah & Vinnie 20s-40s,San Mateo,US,5,1434864502000,87,,,food/drink,,0,,
6141,NoCal Remote Viewing Systems,Berkeley,US,0,1434896781000,12,,,paranormal,,0,,
6142,Hang out group for vegan/vegetarians 18-24  in the Bay Area!,Oakland,US,0,1434933510000,46,,,movements/politics,,0,,
6143,San Francisco for Bernie Sanders,San Francisco,US,0,1434945361000,205,,,movements/politics,,0,,
6144,Teaching Online & Creating Online Courses,San Francisco,US,5,1434994639000,171,,,career/business,,0,,
6145,SF Bay Area Acoustic Guitar Society,San Francisco,US,5,1434994843000,266,,,music,,0,,
6146,Startups Greater Asia (SGA),San Francisco,US,0,1435000230000,184,,,career/business,,0,,
6147,FOCMEQWT Feminine-of-Center Middle-Eastern QueerWomyn Trans,Berkeley,US,0,1435013500000,15,,,LGBT,,0,,
6148,Cosplay Meetup Group (SF/Bay Area/USA),San Francisco,US,0,1435017106000,142,,,sci-fi/fantasy,,0,,
6149,Card Playing Couples,San Francisco,US,5,1435024782000,82,,,games,,0,,
6150,SF Ageless Wisdom discussion group: Books of Creme & Bailey,San Francisco,US,5,1435036449000,16,,,new age/spirituality,,0,,
6151,How Money Works (Chinese/English),Fremont,US,4,1435046672000,69,,,career/business,,0,,
6152,Mission Push Hands,San Francisco,US,5,1435047028000,67,,,sports/recreation,,0,,
6153,Cannabis Social Club - San Francisco,San Francisco,US,0,1435074912000,82,,,socializing,,0,,
6154,San Francisco NuoDB Enthusiasts,San Francisco,US,0,1435086033000,10,,,tech,,0,,
6155,Framer JS Prototypers - San Francisco,San Francisco,US,0,1435096395000,51,,,tech,,0,,
6156,Nonprofit Leaders in San Francisco and Beyond,San Francisco,US,5,1435098563000,35,,,community/environment,,0,,
6157,Great Food 4 Great Cause,Palo Alto,US,0,1435102792000,32,,,food/drink,,0,,
6158,St Mary's Meetup Group,San Francisco,US,0,1435103610000,8,,,religion/beliefs,,0,,
6159,Peninsula Co-working Group,Redwood City,US,0,1435107686000,42,,,career/business,,0,,
6160,Eastbay Ladies Booze & Book Swap,Hayward,US,0,1435115196000,50,,,food/drink,,0,,
6161,Shiloh Young Adults,Oakland,US,0,1435116180000,22,,,religion/beliefs,,0,,
6162,San Francisco Industrial Internet of Things Meetup,San Francisco,US,4.5,1435126399000,127,,,tech,,0,,
6163,"Hike, Sit, Sound",Oakland,US,0,1435153581000,129,,,health/wellbeing,,0,,
6164,Bay Area Streams,San Francisco,US,3.5,1435158878000,463,,,tech,,0,,
6165,Wisdom Presence Practices-Sausalito Meetup,Sausalito,US,0,1435166991000,14,,,career/business,,0,,
6166,San Rafael Original Acoustic Music in the Round Meetup,San Rafael,US,4.88,1435173349000,56,,,music,,0,,
6167,Bay Area Gay Singles Cycling Group,San Francisco,US,0,1435175363000,50,,,LGBT,,0,,
6168,Twilight Tails,San Mateo,US,0,1435181156000,118,,,pets/animals,,0,,
6169,Hispanic Mommies!,San Bruno,US,0,1435193039000,7,,,parents/family,,0,,
6170,"Women, Creativity, & Mythology in Oakland CA",Oakland,US,4.5,1435194028000,25,,,new age/spirituality,,0,,
6171,Thursday After Work,San Francisco,US,5,1435211129000,81,,,tech,,0,,
6172,East Bay Pickup Softball,Oakland,US,4.89,1435212759000,209,,,sports/recreation,,0,,
6173,LAFAYETTE PRIMETIME WOMEN'S REVIVAL -  LIVE A NEW STORY,Martinez,US,4.33,1435253694000,58,,,career/business,,0,,
6174,PENINSULA SMALL APARTMENT & COMMERCIAL INVESTING,San Francisco,US,0,1435258830000,86,,,career/business,,0,,
6175,The Fabric CloudBlazers Forum,Palo Alto,US,4.83,1435268136000,597,,,tech,,0,,
6176,SAMCAR Speakers Toastmasters,San Mateo,US,0,1435269062000,41,,,career/business,,0,,
6177,Point Richmond Women's Divorce/Separation Support Circle,Richmond,US,5,1435269621000,54,,,support,,0,,
6178,Run IT as a Business - South Bay,Palo Alto,US,4.42,1435283144000,270,,,tech,,0,,
6179,Bay Area Millionaire Mind Meetup Business Networking,San Francisco,US,3.5,1435289509000,171,,,career/business,,0,,
6180,Berkeley Tableau Meetup,Berkeley,US,5,1435341072000,124,,,tech,,0,,
6181,Peninsula/South Bay BMW Z3 Meetup,Redwood City,US,0,1435347948000,5,,,cars/motorcycles,,0,,
6182,San Francisco Data Science #ODSC,San Francisco,US,4.9,1435350068000,717,,,tech,,0,,
6183,BondsWell Art & Crafts Meetup,Fremont,US,0,1435359933000,171,,,hobbies/crafts,,0,,
6184,Korean Skincare Enthusiasts,San Francisco,US,4.88,1435368699000,74,,,fashion/beauty,,0,,
6185,SFUSD  African-American Educators Social Meetup,San Francisco,US,5,1435371872000,10,,,socializing,,0,,
6186,Intuition and More,Oakland,US,5,1435508997000,128,,,new age/spirituality,,0,,
6187,Project Chemistry - Making Chemistry Meaningful,San Francisco,US,5,1435509636000,44,,,education/learning,,0,,
6188,Oakland/Berkeley  Personal Growth & Development Meetup,American Canyon,US,0,1435518225000,44,,,new age/spirituality,,0,,
6189,Bay Area Anime and Gaming,San Francisco,US,4.85,1435526916000,336,,,sci-fi/fantasy,,0,,
6190,Art of Feminine Presence-More Magnetism=More Clients + Cash,Berkeley,US,0,1435528428000,37,,,career/business,,0,,
6191,Bay Area Black Designers,Oakland,US,5,1435539594000,94,,,tech,,0,,
6192,Neighborhood Skateboarding (Bay Area),Hayward,US,5,1435543140000,68,,,sports/recreation,,0,,
6193,SF MonkeyLearn - Machine Learning & NLP group,San Francisco,US,0,1435558115000,50,,,tech,,0,,
6194,Wellness Watchers  94501,Alameda,US,0,1435567331000,123,,,health/wellbeing,,0,,
6195,Backend for Angular San Francisco,San Francisco,US,5,1435580552000,188,,,tech,,0,,
6196,Redwood City and North Fair Oaks Real Estate (RWC/NFO),Redwood City,US,0,1435595590000,39,,,career/business,,0,,
6197,East Bay Rosen Method for Joy,Lafayette,US,0,1435614852000,20,,,health/wellbeing,,0,,
6198,Hungry? SF Comfort & Soul Food,San Francisco,US,0,1435623243000,323,,,food/drink,,0,,
6199,Cycling4Fun,Hayward,US,0,1435626975000,136,,,fitness,,0,,
6200,Outside Hacks 3rd Annual Hackathon,San Francisco,US,0,1435627803000,35,,,tech,,0,,
6201,Bay Area Female Bikers,Oakland,US,4.88,1435683931000,14,,,cars/motorcycles,,0,,
6202,Curious Eaters in the City,San Francisco,US,0,1435685337000,289,,,food/drink,,0,,
6203,Startup Grind Fremont,Fremont,US,5,1435691094000,356,,,tech,,0,,
6204,Vallejo Drum Poetry Meetup,Vallejo,US,0,1435706137000,78,,,music,,0,,
6205,Berkeley Drum Poetry Meetup,Berkeley,US,0,1435707522000,99,,,writing,,0,,
6206,San Francisco Nutrition Fundamentals Meetup Group.,San Francisco,US,0,1435707982000,82,,,fitness,,0,,
6207,E.M.E.R.G.E. Collective,Oakland,US,0,1435712527000,44,,,career/business,,0,,
6208,Critosphere Business Community,Fremont,US,0,1435724097000,80,,,career/business,,0,,
6209,Surfing Pacifica,Pacifica,US,4.25,1435733584000,153,,,sports/recreation,,0,,
6210,The Four Foundations of Mindfulness,Oakland,US,0,1435766861000,67,,,health/wellbeing,,0,,
6211,SoccerTraining 101,San Francisco,US,0,1435768161000,76,,,sports/recreation,,0,,
6212,H-1B Foreign Cofounder Network,San Francisco,US,0,1435768760000,182,,,career/business,,0,,
6213,Concord Social and Economic Equity Meetup,Concord,US,0,1435770391000,41,,,movements/politics,,0,,
6214,Advanced Apache Spark Meetup,San Francisco,US,4.87,1435778256000,2388,,,tech,,0,,
6215,Castro Valley Atheist/Agnostic/Freethinker/Humanist Group,Castro Valley,US,4.92,1435782264000,85,,,religion/beliefs,,0,,
6216,Castro Valley A Course In Miracles: ACIM Study Group,Castro Valley,US,5,1435783946000,20,,,new age/spirituality,,0,,
6217,The UX Lab SF,San Francisco,US,5,1435794653000,358,,,tech,,0,,
6218,Clinical Trial Innovation,Berkeley,US,0,1435794810000,33,,,career/business,,0,,
6219,"Love Our Beaches, Clean Them Up",San Francisco,US,5,1435796476000,128,,,community/environment,,0,,
6220,Walnut Creek MDUUC Organic Gardening Class,Walnut Creek,US,0,1435856394000,83,,,community/environment,,0,,
6221,FinTech Impact,San Francisco,US,4.88,1435861545000,455,,,career/business,,0,,
6222,Sierra Club Military Outdoors: San Francisco Bay Area,San Francisco,US,5,1435874662000,40,,,outdoors/adventure,,0,,
6223,Marin Storytelling Circle,San Rafael,US,4.81,1435884190000,73,,,education/learning,,0,,
6224,Social Support for Women with Autoimmune Challenges,Oakland,US,5,1435887501000,117,,,support,,0,,
6225,Queers Makin' Beers,Oakland,US,4.92,1435892393000,187,,,LGBT,,0,,
6226,San Francisco Japanese culture exchange meetup,San Francisco,US,0,1435896232000,281,,,language/ethnic identity,,0,,
6227,San Francisco/Bay Area Asian American Men's Golf,San Francisco,US,0,1435949613000,21,,,sports/recreation,,0,,
6228,Gay Area Queer Vegan/Vegetarian,Oakland,US,4.88,1435955390000,61,,,LGBT,,0,,
6229,Embodied and Empowered Sensuality and Sexuality for Women,Berkeley,US,0,1435963730000,72,,,new age/spirituality,,0,,
6230,San Francisco Adult Orphans,San Francisco,US,5,1435969070000,16,,,support,,0,,
6231,YouWho! San Francisco,San Francisco,US,0,1435984821000,148,,,socializing,,0,,
6232,art history museum lover,San Francisco,US,4.96,1436074877000,279,,,fine arts/culture,,0,,
6233,Access Silicon Valley,Menlo Park,US,0,1436108206000,267,,,tech,,0,,
6234,The Bay Area Aerokinesis Group,San Francisco,US,0,1436114598000,24,,,new age/spirituality,,0,,
6235,Bay Area lesbian/queer/trans dog lovers and friends!,Oakland,US,5,1436123727000,224,,,LGBT,,0,,
6236,San Francisco Bay Area Wine Lover Meetup Group,San Mateo,US,5,1436134983000,193,,,food/drink,,0,,
6237,"Building STEAMs - Science, Tech, Engineering, Art,",Oakland,US,0,1436150778000,46,,,career/business,,0,,
6238,Restaurant & Food Industry in Bay Area,San Francisco,US,0,1436167686000,56,,,career/business,,0,,
6239,TechShop San Francisco,San Francisco,US,0,1436196440000,209,,,tech,,0,,
6240,Investor and Trader Tools: Silicon Valley FinTech,Menlo Park,US,0,1436198112000,112,,,career/business,,0,,
6241,Volleyball for FUN!,San Mateo,US,4.92,1436198732000,284,,,sports/recreation,,0,,
6242,Bay Area Indianapolis Colts Fans,San Francisco,US,0,1436206931000,37,,,sports/recreation,,0,,
6243,Northbay FTM Meetup,San Rafael,US,5,1436215290000,21,,,LGBT,,0,,
6244,IDRA Bay Area Drone Racing,Oakland,US,4.69,1436220508000,250,,,tech,,0,,
6245,Art Allies - San Francisco,San Francisco,US,0,1436221958000,90,,,fine arts/culture,,0,,
6246,San Francisco 80's Fitness Meetup,San Francisco,US,0,1436223358000,92,,,fitness,,0,,
6247,Bate-Papo Brasileiro!,Berkeley,US,5,1436228362000,103,,,language/ethnic identity,,0,,
6248,Containers 101 online meetup,Palo Alto,US,1,1436228718000,503,,,tech,,0,,
6249,San Francisco Urban Gardening - How to Grow Your Own Food!,San Francisco,US,5,1436229136000,133,,,health/wellbeing,,0,,
6250,Entrepreneurs' Weekly Lunch (El Cerrito/North Berkeley),El Cerrito,US,5,1436229141000,109,,,career/business,,0,,
6251,Bay Area Indian Muslim Singles,San Francisco,US,0,1436233443000,11,,,religion/beliefs,,0,,
6252,Ruff Treks,Berkeley,US,5,1436236716000,12,,,outdoors/adventure,,0,,
6253,Movie Trivia by POPCORN POKER Meetup,Oakland,US,5,1436239286000,50,,,movies/film,,0,,
6254,Cooperative Video Gamers,San Francisco,US,5,1436246020000,135,,,games,,0,,
