,group_name,city,country,ratings,created_date,members,last_event,next_event,category,primary_topic,membership_fees,last_event_rsvp,next_event_rsvp
0,Santa Fe Philosophical Society,Santa Fe,US,4.69,1080136965000,180,,,education/learning,,0,,
1,The Santa Fe Mommy Meetup Group,Santa Fe,US,4.76,1182791588000,187,,,parents/family,,0,,
2,The Santa Fe Psychic Development Meetup Group,Santa Fe,US,4.73,1184974272000,128,,,new age/spirituality,,0,,
3,Santa Fe Gamers,Santa Fe,US,4.77,1189407418000,422,,,games,,0,,
4,The Santa Fe Hiking Meetup Group,Santa Fe,US,4.87,1194121138000,2123,,,outdoors/adventure,,0,,
5,Homeschool Group Organizers Across the USA,Santa Fe,US,5,1207960052000,31,,,parents/family,,0,,
6,Santa Fe Software Developers,Santa Fe,US,4.53,1222985242000,390,,,tech,,0,,
7,The Santa Fe Women's Tarot Circle,Santa Fe,US,4.92,1226345721000,302,,,new age/spirituality,,0,,
8,The Santa Fe French Language Meetup Group,Santa Fe,US,4.65,1229532879000,417,,,language/ethnic identity,,0,,
9,Girlfriends of Santa Fe - A Women's Social Group!,Santa Fe,US,4.8,1229852749000,117,,,career/business,,0,,
10,Everyday Center for Spiritual Living,Santa Fe,US,4.95,1233183218000,317,,,new age/spirituality,,0,,
11,The Santa Fe Sound and Energy Healers Group,Santa Fe,US,4.5,1236698514000,72,,,health/wellbeing,,0,,
12,Santa Fe Sound and Energy Healers,Santa Fe,US,5,1236699869000,64,,,health/wellbeing,,0,,
13,Santa Fe Shamanic Healing Journeys with Luisa Kolker,Santa Fe,US,4.96,1241448652000,273,,,new age/spirituality,,0,,
14,THE SANTA FE CO-ED TAROT TRIBE,Santa Fe,US,4.93,1245623946000,378,,,new age/spirituality,,0,,
15,Santa Fe Social Club!,Santa Fe,US,4.7,1252526360000,25,,,career/business,,0,,
16,Santa Fe Area Aromatherapy Group,Santa Fe,US,4.93,1255901085000,61,,,health/wellbeing,,0,,
17,Friends First of Santa Fe,Santa Fe,US,4.64,1260753576000,659,,,singles,,0,,
18,Santa Fe Integral Satsang,Santa Fe,US,0,1263254200000,42,,,new age/spirituality,,0,,
19,This One's for the Girls - Social Group for Women 50+ years,Santa Fe,US,4.85,1264205568000,69,,,socializing,,0,,
20,Santa Fe Healing Arts,Santa Fe,US,4.97,1264308786000,233,,,health/wellbeing,,0,,
21,Santa Fe Poetry and Prose Meetup Group,Santa Fe,US,4.73,1276470751000,590,,,writing,,0,,
22,The Women Entrepreneurs Santa Fe Network,Santa Fe,US,4.91,1284590511000,33,,,career/business,,0,,
23,Santa Fe Gay Men's Discussion Group,Santa Fe,US,4.54,1286119089000,165,,,socializing,,0,,
24,Brain Illumination,Santa Fe,US,5,1286420095000,9,,,photography,,0,,
25,Santa Fe Sai Maa Diksha Training,Santa Fe,US,5,1288568954000,4,,,health/wellbeing,,0,,
26,Santa Fe Spiritual Experiences Group,Santa Fe,US,5,1290982479000,107,,,new age/spirituality,,0,,
27,The Santa Fe Tabletop Gaming Association,Santa Fe,US,5,1291820201000,117,,,games,,0,,
28,Internal Energy Walking,Santa Fe,US,4.99,1291872745000,263,,,health/wellbeing,,0,,
29,The Santa Fe Compassionate Communication Group,Santa Fe,US,4.86,1294542856000,213,,,health/wellbeing,,0,,
30,Tribe Of Singles-Santa Fe Meetup Group,Santa Fe,US,4.61,1308220997000,232,,,singles,,0,,
31,Santa Fe Women's Book Club,Santa Fe,US,4.94,1313766747000,14,,,book clubs,,0,,
32,Spirit Unlimited Santa Fe,Santa Fe,US,4.87,1314232068000,336,,,new age/spirituality,,0,,
33,Santa Fe Photography Group,Santa Fe,US,4.72,1320269969000,71,,,photography,,0,,
34,Santa Fe Veg,Santa Fe,US,4.81,1322631140000,510,,,food/drink,,0,,
35,Santa Fe Sai Maa Enlightened Living Group,Santa Fe,US,4.88,1325887522000,40,,,new age/spirituality,,0,,
36,Santa Fe Sierra Club Outings,Santa Fe,US,4.57,1328815310000,809,,,outdoors/adventure,,0,,
37,Santa Fe Macintosh User Group,Santa Fe,US,4.26,1330078334000,138,,,tech,,0,,
38,Santa Fe Oneness,Santa Fe,US,4.96,1331334370000,85,,,new age/spirituality,,0,,
39,Los Alamos...Yours to Discover,Los Alamos,US,4.39,1336330895000,229,,,socializing,,0,,
40,Santa Fe Astrology Meetup,Santa Fe,US,4.76,1343848864000,157,,,new age/spirituality,,0,,
41,Agents for Conscious Evolution Santa Fe,Santa Fe,US,4.69,1346528359000,105,,,new age/spirituality,,0,,
42,Mah Jongg Players Santa Fe,Santa Fe,US,4.85,1346610650000,123,,,games,,0,,
43,Santa Fe Shakespeare Close Readers,Santa Fe,US,4.9,1349391217000,193,,,book clubs,,0,,
44,The Page Turners - Women's Book Club,Santa Fe,US,4.55,1354491533000,26,,,book clubs,,0,,
45,Transformation Heart Tribe,Santa Fe,US,4,1355190652000,13,,,new age/spirituality,,0,,
46,Conversational German Group,Santa Fe,US,4.84,1356608201000,38,,,language/ethnic identity,,0,,
47,Santa Fe Atheist Community,Santa Fe,US,4.74,1357744521000,155,,,religion/beliefs,,0,,
48,Santa Fe IBD Meetup,Santa Fe,US,4.84,1358277200000,47,,,career/business,,0,,
49,Santa Fe Lightroom  See The Light,Santa Fe,US,4.7,1359317962000,64,,,photography,,0,,
50,Santa Fe Figure Drawing Group,Santa Fe,US,4.95,1360200370000,318,,,fine arts/culture,,0,,
51,Photography and Adobe Photoshop Lessons,Santa Fe,US,4.91,1361321246000,208,,,photography,,0,,
52,Lady Fly Fishers of Santa Fe,Santa Fe,US,4.5,1363621700000,34,,,outdoors/adventure,,0,,
53,"Saturday Morning Life Drawing Group - Santa Fe, NM",Santa Fe,US,4.67,1364928844000,175,,,fine arts/culture,,0,,
54,Santa Fe Chapter The Transition Network,Santa Fe,US,4.74,1366925225000,62,,,socializing,,0,,
55,Santa Fe Gay Men's Writing Group,Santa Fe,US,4.85,1371054192000,28,,,LGBT,,0,,
56,New Mexico Permaculture,Santa Fe,US,5,1374504985000,52,,,community/environment,,0,,
57,No. NM Worker Ownership Resource Collaborative (NNM-WORC),Santa Fe,US,4.81,1375646638000,25,,,community/environment,,0,,
58,The New Mexico Meditation Meet Up,Santa Fe,US,5,1382927670000,357,,,new age/spirituality,,0,,
59,Startup Meetup - Santa Fe,Santa Fe,US,4.77,1382993683000,411,,,career/business,,0,,
60,New Mexico Conscious Movies,Santa Fe,US,4.64,1383186329000,409,,,new age/spirituality,,0,,
61,Los Alamos Entrepreneurs' Network (LAEN),Los Alamos,US,4.69,1383675685000,66,,,career/business,,0,,
62,Art Santa Fe,Santa Fe,US,4.67,1385532197000,486,,,fine arts/culture,,0,,
63,Los Alamos Chamber FAN44,Los Alamos,US,0,1386092044000,6,,,career/business,,0,,
64,Santa Fe Moderate/Social Hiking,Santa Fe,US,4.81,1389374845000,886,,,outdoors/adventure,,0,,
65,Tien Lung Kung Fu of Santa Fe,Santa Fe,US,0,1391035849000,13,,,sports/recreation,,0,,
66,Loving More Chapter Santa Fe,Santa Fe,US,4.7,1391375352000,83,,,health/wellbeing,,0,,
67,Santa Fe Nonfiction Bookclub and MORE!,Santa Fe,US,4.83,1391796223000,56,,,education/learning,,0,,
68,Santa Fe Night Life Meetup,Santa Fe,US,0,1395491243000,37,,,community/environment,,0,,
69,Bollywood Club Invasion Dance Party - East Meets West,Santa Fe,US,0,1395491545000,12,,,dancing,,0,,
70,Santa Fe Spanish Language MeetUp,Santa Fe,US,4.89,1396962519000,33,,,language/ethnic identity,,0,,
71,Enthusiastic Equines - Clicker Training Horses,Santa Fe,US,5,1397596036000,44,,,pets/animals,,0,,
72,"Drumming for the Heart, Spirit, Body, and Mind",Santa Fe,US,5,1402264400000,109,,,music,,0,,
73,"Santa Fe Abraham Uplift! Abraham-Hicks, Law of Attraction",Santa Fe,US,5,1405608281000,71,,,health/wellbeing,,0,,
74,iMattered Memoirs of Santa Fe,Santa Fe,US,5,1405909375000,58,,,writing,,0,,
75,Santa Fe Leadership Meetup,Santa Fe,US,3.93,1407268039000,28,,,career/business,,0,,
76,Santa Fe 20's & 30's Social Meetup,Santa Fe,US,4.69,1408161699000,699,,,socializing,,0,,
77,Los Alamos Game Night,Los Alamos,US,4.5,1408761058000,96,,,games,,0,,
78,Santa Fe Horses for Healing Meetup,Santa Fe,US,0,1409148049000,25,,,community/environment,,0,,
79,The Wilderness Seekers,Cerrillos,US,4.98,1409682369000,502,,,outdoors/adventure,,0,,
80,Mindful Somatics Institute - & MOSI,Santa Fe,US,4.82,1409862752000,240,,,health/wellbeing,,0,,
81,Wednesday Night Tapping Group :: EFT in Santa Fe,Santa Fe,US,5,1410909022000,82,,,health/wellbeing,,0,,
82,Oneness Awakening Course,Santa Fe,US,5,1411072767000,14,,,new age/spirituality,,0,,
83,Santa Fe Area Single Lesbians over 50,Santa Fe,US,4.84,1411512156000,309,,,socializing,,0,,
84,Santa Fe Stargazing Meetup,Santa Fe,US,0,1413334613000,64,,,education/learning,,0,,
85,Santa Fe Pulpwood Queens,Santa Fe,US,0,1414012098000,4,,,book clubs,,0,,
86,"La Tierra Toastmasters Club of Santa Fe, NM",Santa Fe,US,5,1414205241000,52,,,career/business,,0,,
87,Santa Fe Lite/Social Hiking,Santa Fe,US,4.86,1414262796000,730,,,outdoors/adventure,,0,,
88,Northern New Mexico Biotech Meetup,Santa Fe,US,0,1415413076000,15,,,tech,,0,,
89,Santa Fe Stock Investors Idea Exchange,Santa Fe,US,4.79,1415817321000,101,,,career/business,,0,,
90,studio 316a drawing group,Santa Fe,US,0,1418255863000,50,,,fine arts/culture,,0,,
91,Los Alamos Lesbian Social Networking Meetup,Los Alamos,US,0,1418678055000,44,,,LGBT,,0,,
92,Aspen Wellness Walkers,Santa Fe,US,4.93,1420528959000,59,,,fitness,,0,,
93,Just DANCE Santa Fe,Santa Fe,US,4.9,1420648333000,224,,,dancing,,0,,
94,Santa Fe Task Masters Meetup,Santa Fe,US,0,1421122318000,7,,,socializing,,0,,
95,Santa Fe Libertarian Meetup,Santa Fe,US,0,1421599154000,26,,,movements/politics,,0,,
96,Santa Fe Startup Founder 101,Santa Fe,US,4.71,1421963409000,162,,,career/business,,0,,
97,"Sangre de Cristo Needlepointers (Santa Fe, NM)",Santa Fe,US,5,1422056727000,24,,,hobbies/crafts,,0,,
98,Santa Fe Sunrise Toastmasters Meetup,Santa Fe,US,0,1422987851000,48,,,career/business,,0,,
99,"Santa Fe Nerds, Geeks and Gamers Meetup.",Santa Fe,US,4.96,1423091169000,80,,,sci-fi/fantasy,,0,,
100,Los Alamos Luna Chics Full Moon Firecircle Dance,Los Alamos,US,0,1423280911000,28,,,new age/spirituality,,0,,
101,Access Consciousness Meetup,Santa Fe,US,0,1423456684000,27,,,new age/spirituality,,0,,
102,Business Referrals of Santa Fe,Santa Fe,US,4.95,1423622588000,53,,,career/business,,0,,
103,Workshops For Personal Growth,Santa Fe,US,0,1424209038000,150,,,new age/spirituality,,0,,
104,Santa Fe 20s and 30s Ladies Book Club,Santa Fe,US,5,1424230703000,46,,,socializing,,0,,
105,Santa Fe Investment and Real Estate Networking Meetup,Santa Fe,US,4.67,1424704710000,54,,,career/business,,0,,
106,Santa Fe Single Moms and Dads,Santa Fe,US,0,1426715256000,57,,,parents/family,,0,,
107,Eldorado Writing Club Meetup,Santa Fe,US,4.5,1427751423000,44,,,writing,,0,,
108,Rejuve-Nation: Revitalizing Your Health and Wellness,Santa Fe,US,5,1427945960000,7,,,health/wellbeing,,0,,
109,Unity Santa Fe Meetup,Santa Fe,US,5,1428522123000,65,,,health/wellbeing,,0,,
110,The Momentum Club,Santa Fe,US,5,1429305943000,59,,,photography,,0,,
111,"Santa Fe Food, Fitness, and Faith",Santa Fe,US,0,1429821882000,50,,,fitness,,0,,
112,Goodstitches Santa Fe,Santa Fe,US,0,1431471411000,11,,,hobbies/crafts,,0,,
113,Tuesday Afternoon Life Drawing Group – Santa Fe,Santa Fe,US,5,1432398761000,64,,,fine arts/culture,,0,,
114,Santa Fe Dutch Conversational Group,Santa Fe,US,0,1433128306000,7,,,language/ethnic identity,,0,,
115,Santa Fe Transformational Art Group,Santa Fe,US,0,1434202253000,13,,,new age/spirituality,,0,,
116,Living True - Santa Fe,Santa Fe,US,4.77,1435069365000,38,,,health/wellbeing,,0,,
117,studio 316a drawing /sculpting group meet and greet 2,Santa Fe,US,0,1436390747000,25,,,fine arts/culture,,0,,
118,iMattered Memoir Writing Meetup----Santa Fe,Santa Fe,US,0,1436398911000,9,,,writing,,0,,
119,Santa Fe Screenwriters Meetup,Santa Fe,US,5,1436809046000,41,,,writing,,0,,
120,Laugh Santa Fe,Santa Fe,US,5,1436977644000,122,,,health/wellbeing,,0,,
121,Santa Fe Quantum Physics Meetup,Santa Fe,US,0,1437774478000,28,,,education/learning,,0,,
122,Intuitive Lunch!,Santa Fe,US,3,1438111608000,26,,,health/wellbeing,,0,,
123,Santa Fe Bible Study Meetup,Santa Fe,US,0,1438122492000,11,,,religion/beliefs,,0,,
124,From the Ground Up!,Santa Fe,US,0,1438876788000,10,,,fitness,,0,,
125,"Forty-Something, Female, and Other Fun ""F"" Words",Santa Fe,US,3.5,1439664500000,70,,,socializing,,0,,
126,Santa Fe & Albuquerque Real Estate Professional Group,Santa Fe,US,0,1439733828000,14,,,career/business,,0,,
127,Santa Fe Writer's Group,Santa Fe,US,0,1439852067000,34,,,writing,,0,,
128,Tesla Club of New Mexico,Santa Fe,US,4.75,1440344262000,53,,,cars/motorcycles,,0,,
129,Santa Fe Women Reading Graphic Novels,Santa Fe,US,0,1441629012000,17,,,book clubs,,0,,
130,Salons Santa Fe,Santa Fe,US,4.5,1442094769000,147,,,fine arts/culture,,0,,
131,The El Niño Gang,Santa Fe,US,4.95,1442346670000,115,,,sports/recreation,,0,,
132,Santa Fe Birdbrains,Santa Fe,US,3.67,1442770052000,38,,,pets/animals,,0,,
133,Plant Powered Santa Fe,Santa Fe,US,5,1443022573000,93,,,food/drink,,0,,
134,Benevolent Leadership! A Santa Fe Meetup,Santa Fe,US,0,1443112254000,21,,,community/environment,,0,,
135,Santa Fe Drawing Group,Santa Fe,US,0,1443113705000,27,,,fine arts/culture,,0,,
136,Santa Fe ADHD Support Meetup,Santa Fe,US,0,1443122100000,6,,,support,,0,,
137,Los Alamos & Santa Fe People Who Love to Travel Meetup,Los Alamos,US,0,1443202849000,49,,,outdoors/adventure,,0,,
138,Design Lab for Sustainable Neighborhoods,Santa Fe,US,5,1443236494000,56,,,community/environment,,0,,
139,Santa Fe Support Group Meetup--Cerebral Trauma,Santa Fe,US,0,1443664913000,5,,,support,,0,,
140,BETWIXT and BETWEEN,Santa Fe,US,4.94,1443829355000,108,,,socializing,,0,,
141,Santa Fe Botanical and Essential Oils,Santa Fe,US,5,1443977951000,39,,,movements/politics,,0,,
142,Travel Bug Book Group,Santa Fe,US,0,1445269752000,38,,,book clubs,,0,,
143,Los Alamos Miniatures Wargaming Meetup,Los Alamos,US,0,1445299593000,7,,,games,,0,,
144,Santa Fe Outdoors,Santa Fe,US,0,1445706465000,36,,,outdoors/adventure,,0,,
145,Santa Fe Awakening the Third Eye Workshop and Talk,Santa Fe,US,0,1446171919000,31,,,new age/spirituality,,0,,
146,Santa Fe Divorce Support Group,Santa Fe,US,0,1446784087000,14,,,support,,0,,
147,Santa Fe Culturally Jewish - Spiritually Eclectic Meetup,Santa Fe,US,4.6,1446999671000,63,,,religion/beliefs,,0,,
148,Mindful Empowerment - Women's Group,Santa Fe,US,5,1447627482000,16,,,health/wellbeing,,0,,
149,New Mexico Aquaponics Meetup,Santa Fe,US,4.8,1447703816000,43,,,community/environment,,0,,
150,Santa Fe Short Path Meetup,Santa Fe,US,0,1447958972000,10,,,religion/beliefs,,0,,
151,Photographic Exploration of Ghost Towns of New Mexico,Santa Fe,US,5,1448034358000,50,,,outdoors/adventure,,0,,
152,Santa Fe Dynamos,Santa Fe,US,0,1448252855000,11,,,health/wellbeing,,0,,
153,Santa Fe Off-Road Motorcycling and Hiking,Santa Fe,US,0,1448484402000,18,,,outdoors/adventure,,0,,
154,Golf Gypsies Meetup Group,Santa Fe,US,0,1449423070000,15,,,outdoors/adventure,,0,,
155,Edgewood/Stanley Oil Painting -  Meetup,Santa Fe,US,0,1450109644000,3,,,fine arts/culture,,0,,
156,Santa Fe Acoustic Musicians Meetup,Santa Fe,US,4.58,1451264527000,29,,,music,,0,,
157,"Whovians of New, New, New, New Mexico",Santa Fe,US,0,1451419394000,5,,,sci-fi/fantasy,,0,,
158,Stories and Cider Book Club - Santa Fe,Santa Fe,US,4.5,1451538268000,29,,,book clubs,,0,,
159,Women on Adventures Santa Fe,Santa Fe,US,5,1451573763000,143,,,outdoors/adventure,,0,,
160,Santa Fe and Surrounding areas Haunted Places Meetup,Santa Fe,US,0,1451704425000,16,,,paranormal,,0,,
161,Santa Fe Life After Death Meetup,Santa Fe,US,5,1451871040000,39,,,new age/spirituality,,0,,
162,Breast Wishes Fund Support Group,Santa Fe,US,0,1452030005000,4,,,health/wellbeing,,0,,
163,Santa Fe Centering Prayer/Meditation Meetup,Santa Fe,US,0,1452202510000,13,,,new age/spirituality,,0,,
164,Santa Fe Independent Filmmaking Meetup,Santa Fe,US,0,1452281564000,30,,,movies/film,,0,,
165,ARTFUL YOU!,Santa Fe,US,5,1452448067000,60,,,fine arts/culture,,0,,
166,Journey Mapping Mystery School,Santa Fe,US,0,1452615345000,13,,,new age/spirituality,,0,,
167,Design Corps of Santa Fe,Santa Fe,US,0,1452621228000,34,,,tech,,0,,
168,Northern New Mexico Tea Party Meetup,Santa Fe,US,0,1452828699000,4,,,movements/politics,,0,,
169,Santa Fe Dancing for Parkinson's/Movement Disorders Meetup,Santa Fe,US,0,1453057059000,4,,,dancing,,0,,
170,Discover New Mexico !,Santa Fe,US,5,1453226931000,150,,,outdoors/adventure,,0,,
171,Santa Fe Reiki Share and Energy Healing,Santa Fe,US,0,1453316538000,34,,,health/wellbeing,,0,,
172,Chris Griscom and The Light Institute,Lamy,US,0,1453328765000,29,,,new age/spirituality,,0,,
173,The Santa Fe Chapter of the Rush Limbaugh Dinner Club,Santa Fe,US,0,1453332429000,19,,,socializing,,0,,
174,Santa Fe Arts Professionals Meetup,Santa Fe,US,0,1453518456000,19,,,fine arts/culture,,0,,
175,Santa Fe Young Professionals,Santa Fe,US,0,1453749111000,43,,,socializing,,0,,
176,Santa Fe Eastern Spirituality Group,Santa Fe,US,0,1453923220000,22,,,new age/spirituality,,0,,
177,Santa Fe Honesty in Action,Santa Fe,US,0,1454012496000,3,,,health/wellbeing,,0,,
178,Santa Fe Over 50 Outdoors,Santa Fe,US,0,1454014262000,40,,,outdoors/adventure,,0,,
179,Santa Fe Sing and Play Acoustic Covers Casual Hang Out,Santa Fe,US,0,1454084419000,5,,,music,,0,,
180,The Artist 's Way Group w Mary Jo,Santa Fe,US,0,1454089633000,1,,,fine arts/culture,,0,,
181,#SFPHP Meetup,San Francisco,US,4.31,1034097740000,2609,,,tech,,0,,
182,San Franciso Game Development Meetup Group,San Francisco,US,4.39,1034097741000,3622,,,career/business,,0,,
183,San Francisco Spanish-Language MeetUp,San Francisco,US,4.46,1034097748000,4519,,,language/ethnic identity,,0,,
184,Alameda / Contra Costa Co. Rendez-vous français,Berkeley,US,4.65,1034097748000,855,,,language/ethnic identity,,0,,
185,Join Cofounders Meetup on Google+ hangout 2nd. Thu @ 7PM PST,San Francisco,US,4.07,1034097750000,839,,,tech,,0,,
186,中文俱樂部 Chinese Language Group in The San Francisco Bay Area,San Francisco,US,4.71,1034280794000,1740,,,language/ethnic identity,,0,,
187,SF & SV Entrepreneurs + VCs,San Francisco,US,3.97,1036177353000,3214,,,career/business,,0,,
188,The San Francisco Bay Area British and Irish Social Club,San Francisco,US,4.47,1037751568000,1685,,,language/ethnic identity,,0,,
189,SF German Stammtisch,San Francisco,US,4.63,1038550996000,2832,,,language/ethnic identity,,0,,
190,The San Francisco Italian Language Meetup Group,San Francisco,US,4.51,1041537562000,1490,,,language/ethnic identity,,0,,
191,LES AMI(E)S FRANCOPHONES DE SAN FRANCISCO,San Francisco,US,4.49,1042324556000,3206,,,language/ethnic identity,,0,,
192,San Francisco for Democracy Meetup Group,San Francisco,US,4.53,1042513984000,902,,,movements/politics,,0,,
193,"East Bay ""Democracy for America"" Meetup",Oakland,US,4.39,1045608717000,738,,,movements/politics,,0,,
194,The San Francisco English Bulldog Meetup Group,San Francisco,US,4.48,1045682815000,2028,,,pets/animals,,0,,
195,SF Travel Addicts,San Francisco,US,4.55,1048147539000,1848,,,socializing,,0,,
196,Bay Area Integral Salon! :),Palo Alto,US,4.55,1048812374000,77,,,new age/spirituality,,0,,
197,The San Francisco Yorkshire Terrier Meetup Group,San Francisco,US,4.73,1049407174000,834,,,pets/animals,,0,,
198,The San Francisco Shih Tzu Meetup Group,San Francisco,US,4.75,1049676248000,579,,,pets/animals,,0,,
199,The San Francisco Investor's Business Daily Meetup Group,San Francisco,US,4.49,1062018755000,1403,,,career/business,,0,,
200,The San Francisco Formula 1 Meetup Group,San Francisco,US,4.55,1066858789000,766,,,cars/motorcycles,,0,,
201,The Marin County Investor's Business Daily Meetup Group,Belvedere Tiburon,US,4.58,1066858789000,373,,,career/business,,0,,
202,The San Francisco Peninsula Dads Meetup Group,Palo Alto,US,4.86,1066858789000,232,,,parents/family,,0,,
203,East Bay Cohousing - Berkeley/Oakland/Emeryville/SF,Berkeley,US,4.6,1066858789000,3718,,,community/environment,,0,,
204,The San Francisco Ruby Meetup Group,San Francisco,US,4.6,1067365352000,6076,,,tech,,0,,
205,#SFMySQL Meetup,San Francisco,US,4.39,1079430319000,2321,,,tech,,0,,
206,The Contra Costa County Moms Meetup Group,Martinez,US,4.85,1081446112000,114,,,parents/family,,0,,
207,SFBA Karaoke Meetup! :),San Francisco,US,4.74,1090778095000,897,,,music,,0,,
208,SOCIAL SAN FRANCISCO,San Francisco,US,4.72,1097630589000,3261,,,socializing,,0,,
209,Silicon Valley MySQL Group,Palo Alto,US,4.43,1102659536000,781,,,tech,,0,,
210,"East Bay Repetitive Strain Injury Support Group, Berkeley,CA",Berkeley,US,4.77,1105213698000,187,,,career/business,,0,,
211,Bay Area Media Makers,San Francisco,US,3.61,1112627804000,366,,,career/business,,0,,
212,The Transformation Collective,San Francisco,US,4.77,1113108973000,461,,,cars/motorcycles,,0,,
213,Design Pros SF Bay Area • DPSFBA,San Francisco,US,4.67,1114366988000,608,,,photography,,0,,
214,"Reiki, Karuna Reiki & Meditation classes",Fremont,US,4.92,1120101341000,496,,,health/wellbeing,,0,,
215,Bay Area Beagles,Hayward,US,4.68,1126546408000,636,,,pets/animals,,0,,
216,The San Francisco Boston Terrier Meetup Group,San Francisco,US,4.63,1136835047000,395,,,pets/animals,,0,,
217,Super Fabulicious Hiking and Outdoor Adventure Group,San Francisco,US,4.83,1137636757000,8628,,,outdoors/adventure,,0,,
218,Silicon Valley NewTech (SVNewTech),Palo Alto,US,4.61,1138071172000,13669,,,career/business,,0,,
219,San Francisco Tech4Good,San Francisco,US,4.61,1138120620000,3932,,,tech,,0,,
220,The Bay Area Attachment Parenting Meetup Group,Walnut Creek,US,4.6,1141069057000,332,,,parents/family,,0,,
221,The San Francisco Fashion Industry Meetup Group,San Francisco,US,4.63,1142198028000,307,,,fashion/beauty,,0,,
222,SF New Tech,San Francisco,US,4.54,1142631963000,8003,,,tech,,0,,
223,The Bay Area Great Dane Meetup Group,San Leandro,US,4.75,1143175630000,304,,,pets/animals,,0,,
224,The San Francisco Bay Area PostgreSQL Meetup Group,San Francisco,US,4.57,1143240078000,1222,,,tech,,0,,
225,Bay Area Fun Fellows Club,Palo Alto,US,4.68,1144285517000,1676,,,socializing,,0,,
226,The San Francisco Expat Canadian Meetup Group,San Francisco,US,4.71,1144360103000,1346,,,language/ethnic identity,,0,,
227,The San Francisco Photography Meetup Group,San Francisco,US,4.53,1144704056000,3778,,,photography,,0,,
228,The San Francisco Figure Drawing Group,San Francisco,US,4.7,1145249420000,2750,,,fine arts/culture,,0,,
229,Silicon Valley Ruby on Rails,Palo Alto,US,4.54,1147395009000,2701,,,tech,,0,,
230,SalsaCrazy's San Francisco Bay Area Salsa Dance Meetup,San Francisco,US,4.68,1147455190000,2584,,,dancing,,0,,
231,San Francisco Online Community Meetup Group,San Francisco,US,4.59,1147476947000,2000,,,career/business,,0,,
232,The Concord Italian Language Meetup Group (CILMG),Concord,US,4.77,1148187040000,293,,,language/ethnic identity,,0,,
233,Bay Area Film Society,San Francisco,US,4.53,1148586753000,5029,,,movies/film,,0,,
234,The Stars Are Right!  Call Of Cthulhu,Emeryville,US,4.86,1149256402000,154,,,games,,0,,
235,The San Francisco Single 30 & 40-Somethings Social Group,San Francisco,US,4.6,1149616522000,2306,,,socializing,,0,,
236,San Francisco Wine Lovers Group,San Francisco,US,4.58,1149734940000,2623,,,food/drink,,0,,
237,Clothing Swap And Events,Oakland,US,4.7,1151443545000,932,,,socializing,,0,,
238,The San Francisco Europe Meetup Group,San Francisco,US,4.67,1153709491000,959,,,language/ethnic identity,,0,,
239,SF Bay Area Nightlife & Social Events,San Francisco,US,4.48,1153711920000,4980,,,socializing,,0,,
240,SF Founder Club,San Francisco,US,4.63,1153936112000,5144,,,tech,,0,,
241,The San Francisco Play Reading Meetup Group,San Francisco,US,4.64,1153952841000,258,,,fine arts/culture,,0,,
242,San Francisco Vegan Events,San Francisco,US,4.58,1154022197000,2799,,,food/drink,,0,,
243,San Francisco East Bay Entrepreneurs & Networkers,Oakland,US,4.87,1154467165000,1674,,,career/business,,0,,
244,Peninsula French Movies & More,Palo Alto,US,4.33,1154878159000,614,,,movies/film,,0,,
245,Berkeley Philosophy Reading Group,Berkeley,US,4.55,1154934240000,492,,,education/learning,,0,,
246,Startup Addicts,San Francisco,US,4.61,1155750284000,1599,,,tech,,0,,
247,Flatmate Meetup : San Francisco Roommates Finder,San Francisco,US,3.9,1156139693000,2042,,,socializing,,0,,
248,The Walnut Creek Area Dining Out & Social Group,Walnut Creek,US,4.5,1156216300000,1005,,,food/drink,,0,,
249,The East Bay Ruby Meetup Group,Berkeley,US,4.44,1156355252000,1925,,,tech,,0,,
250,Around the Crafting Table,Fremont,US,4.96,1156533495000,72,,,hobbies/crafts,,0,,
251,Thirty Day Challenge San Francisco,San Francisco,US,4.92,1156711861000,130,,,career/business,,0,,
252,FailCon + Discounted Startup Events,San Francisco,US,4.21,1157830270000,1600,,,tech,,0,,
253,Bretons of California,San Francisco,US,4.73,1158352225000,317,,,language/ethnic identity,,0,,
254,The San Francisco Philosophy Group,San Francisco,US,4.61,1158725963000,859,,,education/learning,,0,,
255,The Berkeley Writers Circle,Berkeley,US,4.55,1158962003000,840,,,writing,,0,,
256,Bay Area Shamanism Meetup Group,Lafayette,US,4.93,1159479937000,531,,,religion/beliefs,,0,,
257,Aging In Community - San Francisco Bay Area,Berkeley,US,4.55,1159494155000,344,,,community/environment,,0,,
258,SF *Brazilian* Portuguese Language (and dancing!) Meetups,San Francisco,US,4.6,1159749252000,2385,,,language/ethnic identity,,0,,
259,Society for New Communications Research Meetup Group,Palo Alto,US,4.37,1160091709000,264,,,career/business,,0,,
260,The Secret Exposed!,Walnut Creek,US,4.83,1160296815000,307,,,health/wellbeing,,0,,
261,SF Dives,San Francisco,US,4.68,1160386833000,892,,,socializing,,0,,
262,The San Francisco Brunch Club,San Francisco,US,4.62,1161061117000,1584,,,food/drink,,0,,
263,Meetup Community Organizers,San Francisco,US,4.66,1161387771000,158,,,pets/animals,,0,,
264,Entrepreneur & Small Business Academy,Berkeley,US,4.66,1162510181000,3200,,,career/business,,0,,
265,San Francisco Chihuahua Meetup,San Francisco,US,4.83,1162579376000,1105,,,pets/animals,,0,,
266,"The Uplifting ""Table of Life""",San Carlos,US,4.96,1163010452000,496,,,food/drink,,0,,
267,All About Stitches :),Pleasant Hill,US,4.87,1163087058000,33,,,hobbies/crafts,,0,,
268,The Oakland Real Estate Buying & Investing Meetup Group,Oakland,US,4.66,1163622996000,546,,,career/business,,0,,
269,The Palo Alto Scrabble Meetup Group,Palo Alto,US,4.81,1164237212000,247,,,games,,0,,
270,Bay Area Dining Club,San Francisco,US,4.5,1164486954000,2688,,,singles,,0,,
